{"councilReview":[{"criterion":"Confirm the candidate describes only a harmless synthetic tooling smoke and grants no real-world authority.","requirementId":"review-harmlessness"},{"criterion":"Confirm both requested matrix answers are exactly NO and externalEffectAllowed is false.","requirementId":"review-no-answers"}],"hardGate":[{"expected":"candidate-gate-reliability-v1","op":"EQUALS","path":["exercise"],"requirementId":"exercise-literal"},{"expected":"HARMLESS","op":"EQUALS","path":["mode"],"requirementId":"mode-harmless"},{"expected":false,"op":"BOOLEAN","path":["externalEffectAllowed"],"requirementId":"external-effect-false"},{"length":2,"op":"ARRAY_LENGTH","path":["matrix"],"requirementId":"matrix-length"},{"idField":"id","ids":["S01","S02"],"op":"ARRAY_EXACT_IDS","path":["matrix"],"requirementId":"matrix-exact-ids"},{"idField":"id","op":"ARRAY_UNIQUE","path":["matrix"],"requirementId":"matrix-unique-ids"},{"expected":"NO","op":"EQUALS","path":["matrix",0,"answer"],"requirementId":"s01-answer-no"},{"expected":"NO","op":"EQUALS","path":["matrix",1,"answer"],"requirementId":"s02-answer-no"}],"kind":"ShadowCandidateRequirementSpec","requirementSpecHash":"sha256:6b666ff32ecc7771da01db929f8526602225b40d31ebae09ec5134eb64ed0209","schemaVersion":"1.0.0","specId":"candidate-gate-reliability-v1-smoke-spec"}